{
  "schemaVersion": "1.0.0",
  "formId": "irs_1040_2025",
  "formName": "U.S. Individual Income Tax Return",
  "taxYear": 2025,
  "version": "1.0.0",
  "coordinateSystem": {
    "space": "normalized",
    "origin": "top_left",
    "xAxis": "left_to_right",
    "yAxis": "top_to_bottom"
  },
  "pages": [
    {
      "pageNumber": 1,
      "label": "Page 1",
      "widthPoints": 612,
      "heightPoints": 792,
      "annotations": [
        {
          "id": "taxpayer",
          "type": "group",
          "label": "Taxpayer",
          "children": [
            {
              "id": "taxpayer.firstName",
              "type": "field",
              "label": "First Name",
              "fieldType": "text",
              "valueRef": { "path": "$.taxpayer.legal.firstName" },
              "bindingPath": "$.taxpayer.legal.firstName",
              "semanticEntity": "Person.firstName",
              "validation": { "required": true, "maxLength": 50 },
              "appearance": { "fontSize": 10, "textAlign": "left", "color": "#000000" },
              "boundingBox": { "x": 0.08, "y": 0.118, "width": 0.22, "height": 0.018 },
              "extractionConfidence": 0.97,
              "reviewStatus": "approved"
            },
            {
              "id": "taxpayer.lastName",
              "type": "field",
              "label": "Last Name",
              "fieldType": "text",
              "valueRef": { "path": "$.taxpayer.legal.lastName" },
              "bindingPath": "$.taxpayer.legal.lastName",
              "semanticEntity": "Person.lastName",
              "validation": { "required": true, "maxLength": 50 },
              "appearance": { "fontSize": 10, "textAlign": "left", "color": "#000000" },
              "boundingBox": { "x": 0.31, "y": 0.118, "width": 0.28, "height": 0.018 },
              "extractionConfidence": 0.96,
              "reviewStatus": "approved"
            },
            {
              "id": "taxpayer.ssn",
              "type": "field",
              "label": "SSN",
              "fieldType": "ssn",
              "valueRef": { "path": "$.taxpayer.identifiers.ssn" },
              "bindingPath": "$.taxpayer.identifiers.ssn",
              "semanticEntity": "Person.ssn",
              "validation": {
                "required": true,
                "pattern": "^\\d{9}$",
                "message": "SSN must be 9 digits"
              },
              "appearance": { "fontSize": 10, "textAlign": "left", "color": "#000000" },
              "boundingBox": { "x": 0.72, "y": 0.118, "width": 0.2, "height": 0.018 },
              "extractionConfidence": 0.94,
              "reviewStatus": "needs_review"
            },
            {
              "id": "taxpayer.dateOfBirth",
              "type": "field",
              "label": "Date Of Birth",
              "fieldType": "date",
              "valueRef": { "path": "$.taxpayer.dateOfBirth" },
              "bindingPath": "$.taxpayer.dateOfBirth",
              "semanticEntity": "Person.dateOfBirth",
              "validation": { "required": true },
              "appearance": { "fontSize": 10, "textAlign": "left", "color": "#000000" },
              "format": { "date": { "pattern": "MM/DD/YYYY" } },
              "boundingBox": { "x": 0.08, "y": 0.148, "width": 0.18, "height": 0.018 },
              "extractionConfidence": 0.91,
              "reviewStatus": "approved"
            }
          ]
        },
        {
          "id": "employer",
          "type": "group",
          "label": "Employer",
          "children": [
            {
              "id": "employer.companyName",
              "type": "field",
              "label": "Company Name",
              "fieldType": "text",
              "valueRef": { "path": "$.income.w2Forms[0].employer.name" },
              "bindingPath": "$.income.w2Forms[0].employer.name",
              "semanticEntity": "Organization.name",
              "validation": { "required": false, "maxLength": 100 },
              "appearance": { "fontSize": 10, "textAlign": "left", "color": "#000000" },
              "boundingBox": { "x": 0.08, "y": 0.198, "width": 0.42, "height": 0.018 },
              "extractionConfidence": 0.89,
              "reviewStatus": "approved"
            },
            {
              "id": "employer.ein",
              "type": "field",
              "label": "EIN",
              "fieldType": "ein",
              "valueRef": { "path": "$.income.w2Forms[0].employer.ein" },
              "bindingPath": "$.income.w2Forms[0].employer.ein",
              "semanticEntity": "Organization.ein",
              "validation": { "required": false, "pattern": "^\\d{2}-\\d{7}$" },
              "appearance": { "fontSize": 10, "textAlign": "left", "color": "#000000" },
              "boundingBox": { "x": 0.72, "y": 0.198, "width": 0.2, "height": 0.018 },
              "extractionConfidence": 0.87,
              "reviewStatus": "pending"
            }
          ]
        },
        {
          "id": "dependents",
          "type": "collection",
          "label": "Dependents",
          "collectionItemLabel": "Dependent",
          "rowStride": 0.02,
          "children": [
            {
              "id": "dependents.item.firstName",
              "type": "field",
              "label": "First Name",
              "fieldType": "text",
              "valueRef": { "path": "$.dependents[].legal.firstName" },
              "bindingPath": "$.dependents[].legal.firstName",
              "semanticEntity": "Person.firstName",
              "appearance": { "fontSize": 9, "textAlign": "left", "color": "#000000" },
              "boundingBox": { "x": 0.08, "y": 0.278, "width": 0.2, "height": 0.016 },
              "extractionConfidence": 0.85,
              "reviewStatus": "approved"
            },
            {
              "id": "dependents.item.ssn",
              "type": "field",
              "label": "SSN",
              "fieldType": "ssn",
              "valueRef": { "path": "$.dependents[].identifiers.ssn" },
              "bindingPath": "$.dependents[].identifiers.ssn",
              "semanticEntity": "Person.ssn",
              "appearance": { "fontSize": 9, "textAlign": "left", "color": "#000000" },
              "boundingBox": { "x": 0.42, "y": 0.278, "width": 0.18, "height": 0.016 },
              "extractionConfidence": 0.82,
              "reviewStatus": "needs_review"
            },
            {
              "id": "dependents.item.relationship",
              "type": "field",
              "label": "Relationship",
              "fieldType": "text",
              "valueRef": { "path": "$.dependents[].relationship" },
              "bindingPath": "$.dependents[].relationship",
              "semanticEntity": "Person.relationship",
              "appearance": { "fontSize": 9, "textAlign": "left", "color": "#000000" },
              "boundingBox": { "x": 0.72, "y": 0.278, "width": 0.18, "height": 0.016 },
              "extractionConfidence": 0.88,
              "reviewStatus": "approved"
            }
          ]
        },
        {
          "id": "income.wages",
          "type": "field",
          "label": "Wages, Salaries, Tips",
          "fieldType": "currency",
          "valueRef": { "path": "$.income.w2Forms[0].wages" },
          "bindingPath": "$.income.w2Forms[0].wages",
          "semanticEntity": "Income.wages",
          "validation": { "required": false },
          "appearance": { "fontSize": 10, "textAlign": "right", "color": "#000000" },
          "format": {
            "currency": { "currencyCode": "USD", "locale": "en-US", "minimumFractionDigits": 2 }
          },
          "boundingBox": { "x": 0.72, "y": 0.358, "width": 0.2, "height": 0.018 },
          "extractionConfidence": 0.93,
          "reviewStatus": "approved"
        },
        {
          "id": "income.taxableInterest",
          "type": "field",
          "label": "Taxable Interest",
          "fieldType": "currency",
          "valueRef": { "path": "$.income.interest.taxable" },
          "bindingPath": "$.income.interest.taxable",
          "semanticEntity": "Income.interest",
          "appearance": { "fontSize": 10, "textAlign": "right", "color": "#000000" },
          "format": {
            "currency": { "currencyCode": "USD", "locale": "en-US", "minimumFractionDigits": 2 }
          },
          "boundingBox": { "x": 0.72, "y": 0.388, "width": 0.2, "height": 0.018 },
          "extractionConfidence": 0.9,
          "reviewStatus": "approved"
        },
        {
          "id": "filingStatus.single",
          "type": "field",
          "label": "Single Filing Status",
          "fieldType": "checkbox",
          "valueRef": { "path": "$.filingStatus.single" },
          "bindingPath": "$.filingStatus.single",
          "semanticEntity": "TaxReturn.filingStatus",
          "appearance": { "fontSize": 10, "textAlign": "center", "color": "#000000" },
          "format": { "checkbox": { "mark": "X" } },
          "boundingBox": { "x": 0.08, "y": 0.088, "width": 0.012, "height": 0.012 },
          "extractionConfidence": 0.99,
          "reviewStatus": "approved"
        }
      ]
    }
  ]
}
